index,screen_name,user_id,tweet_text,length
93,BBHealthForum,3044858698,Week 5 of Life Choices Programme @YcTower  Tonight Killian from @HSweenyChemist came along and spoke to the group a… ,117
94,BBHealthForum,3044858698,Week 3 of Life Choices Programme with Leafair Community Association young people! Last nights session was our physi… ,117
95,BBHealthForum,3044858698,End of the road for Kayla and the Rickshaw team. Massive congratulations to each and every one of you. We are so pr… ,117
96,BBHealthForum,3044858698,On our way to London. Tune into BBC The One Show tonight when Kayla and the Rickshaw Team will say their final good… ,117
97,BBHealthForum,3044858698,Thank you to @StCeciliasDerry pupil Kate Hutton who was on placement with us. Kate supported in the delivery of pro… ,117
98,BBHealthForum,3044858698,Well done @StCeciliasDerry supporting Kayla and #TeamRickshaw today with their sponsor cycle and fun day @BBCCiN… ,114
99,BBHealthForum,3044858698,Oisin and Aileen at @BBCCiN Appeals evening in Belfast ,55
100,BBHealthForum,3044858698,Last day tomorrow for the Rickshaw Challenge well done team and good luck tomorrow to Kayla and the team. We can't… ,116
159,jackerufu,2189312575,"I usually run 20 laps at the gym to finish off a workout (which is usually a challenge for me), but somehow I ran 3… ",117
160,jackerufu,2189312575,I just bought the first of the fabric for Newt!!!!! ,52
161,jackerufu,2189312575,I’ve been sitting in bed for the past 10 minutes just watching the snow fall in the moonlight through my bedroom wi… ,117
836,Tidge24,457034662,"Hey, @KapanenTV is hosting a game giveaway for his followers! Here is the link --&amp;gt;",89
970,DavidTheVillain,228216679,When the pre workout hits ,26
971,DavidTheVillain,228216679,"If you know, you know!! ",24
972,DavidTheVillain,228216679,"Mood, Always. ",14
1061,alessahinlo,389401683,"Since I'm in Florida visiting my parents, I've been relying on YouTube yoga to replace my studio practice. I did th… ",117
1062,alessahinlo,389401683,I'm seriously thinking about subscribing to that monthly succulent box. Maybe taking care of low-key succulents dur… ,117
1109,osirisfotos,3786782713,Some guys are just Supermen everyday. No time for Clark Kent!  DemiGod: man_of_steelcw #bodybuilding #fitness… ,111
1110,osirisfotos,3786782713,"Ok, ⁦@KimKardashian⁩...you are the MVP for that dress on Ellen!  Brightened up my day!  DAMN!!  #EllenDeGeneres ",112
1459,SuperJanGames,59866544,"Finally made it to the gym for a decent workout, just in time for my 6 month gymiversary! 💪 ",92
1608,TheMaxWhite,1117483992,Long-distance-runner-social-media-achievement-unlocked ,55
1655,cbb515,364370452,Post Workout Treat!!!! ,23
1656,cbb515,364370452,Sometimes MNF Buddy blocks my view!!  #laprottie ,49
1792,k1rab0shi,515499131,So Davao is basically a police state. More on this later ,57
1793,k1rab0shi,515499131,Post workout swim ,18
1902,mr_leveluppt,1157337986,My pre-itis food day workout! 3 sets each of what's in black and 2 sets of what's in green! #TeamLevelUpPT #fitness… ,117
1903,Buff_mum,54789230,So T saw my fitness IG post. But didn’t like it. ,49
2272,emjo_,15827491,"Abs, ass, and back so sore from aerial yoga ",44
2273,emjo_,15827491,I make money moves ,19
2274,emjo_,15827491,"you're welcome

",16
2275,emjo_,15827491,My lips are chapped from the ice luge 🤗 ,40
2335,JackParsons_CEO,229211585,"In Jack’s mind:

Positive Jack “Jack go for a midnight run. Remember it’s about looking after your health and fitne… ",117
2336,JackParsons_CEO,229211585,A Side Hustle Is Your New Way Of Life!  ,40
2337,JackParsons_CEO,229211585,It was great to share the voice of the young people when it comes to the apprenticeship levy and what we really nee… ,117
2464,RealBHogenson,2310246914,Best pure runner of all time. Also dumb as a God damned rock. ,62
2876,Rubberbandits,68151046,Rutger Hauer on the Blade Runner set looking fairly 2019 ,57
2877,Rubberbandits,68151046,This puts it into a language that the contrarians can understand ,65
2977,lynllamoso,86744540,"I'm at Pound for Pound Fitness - Makati in Makati, Metro Manila ",64
2978,lynllamoso,86744540,"You prove to be an excellent collaborator, whether as a partne... More for Cancer ",82
2979,lynllamoso,86744540,"You can’t seem to sit still, and your restlessness will only i... More for Cancer ",82
2980,lynllamoso,86744540,Others might feel like they must tread on eggshells around you... More for Cancer ,82
3038,tperkinsbball23,236160906,"The date &amp; location is set for the 3rd Annual FAB 40 FROSH/SOPH Workout (Invite-Only).

⌚ March 2, 2019 at 9:00 AM… ",120
3039,tperkinsbball23,236160906,We may host an official qualifying event for the 2019 U.S. Open Basketball Championships! #FloridaBasketballBulletin ,117
3194,D3sC0,14628107,"I'm at Workout Station in Pozos, San Jose ",42
3386,iCyclone,16539917,Four-mile hill workout. Not a *terrible* pace given some of the killer climbs—especially the one around the halfway… ,117
3387,iCyclone,16539917,"N Hemisphere chase season seems to be over—bit shooting for #HurricaneMan ain't. Long weekend shoot, this time in L… ",117
3388,iCyclone,16539917,Latenight protein bomb after a brutal leg workout. In my usual perch: the very back booth at @k24hollywood. ,108
3389,andybigmickey,40761096,I walked outdoors for 6.65 MI with the Workout app on my #AppleWatch. ,70
3457,almaruelas1012,2421385898,hiking in the morning would always be the best workout ❤ ,57
3725,brizzy034,384357565,"Guy: can we switch legs... mine don’t wanna grow...
Me: well all you ever workout is arms and abs sooooo... ",108
4190,SageNoelle,404466353,"Standing at Bull Head Peak, highest point in Clarendon, Jamaica and the geographic center of the island!… ",106
4191,SageNoelle,404466353,Queen trees in bloom! #blooming #jamaica #flowerpower ,54
4192,SageNoelle,404466353,July Empress Newsletter  ,25
4243,cyberyel,579152002,"me: i am having an existential crisis and also   a mental breakdown hel p
girls on instagram: just do yoga and be v… ",117
4244,Buitrxn,3258392994,Lady Gaga pushed me through my workout 😌💖💖 ,43
4361,Mudjokivis,19343211,"Theresa May saw a merry-go-round running out of control and children were being injured. Did she...
1 Leave it carr… ",117
4563,MissXI_,1567398590,More updates!! 😊🐠 staying at a yoga retreat with a permaculture garden!! So nice ,81
4564,MissXI_,1567398590,Update #1 ,10
4565,MissXI_,1567398590,Ps. Don't eat lettuce. ,23
4566,MissXI_,1567398590,Off to 🇲🇽 Mexico!! I'll be replying all emails when I return December 5. Cheers! 🍻 ,83
4567,MissXI_,1567398590,A #superfan just rebilled! See what all the buzz is about:  ,60
4568,MissXI_,1567398590,"Two days until I am in Mexico 🇲🇽!!
This jellyfish was at the Vancouver Aquarium, where I went with My sub J who vis… ",117
4644,hblx,39086364,LoLoLoL at all the #angrycarmen who are banging on about insurance and road tax and tests and registration for cycl… ,117
4670,KenY2Ken,18964560,"Gotta be the front-runner for ""Most imaginative Sean Bean takedown"" I've seen so far. ",86
4671,KenY2Ken,18964560,Was discussing how Agent 47 is a little more chatty in Hitman 2 and it's fantastic - that final line delivery crack… ,117
4764,FernandoBravo14,365786045,Friday Mood vs Monday Mood ,27
4803,bikewalkperth,3063063571,I am grateful that a WA MP has given BWP the opportunity to submit questions for them to consider asking the Minist… ,117
4804,bikewalkperth,3063063571,"Comparing costs at Perth's popular cafe strips:
 
This is a good piece of research by @winestein32 One omission is… ",116
4805,reynarodriguezz,610247827,My finds at goodwill today... Calvin Klein workout leggings....adidas leggings w/ logo on the side (brand new)... t… ,117
5007,KalebFirkins,160359639,My guy mentions his gang in every song now he’s trying to say he’s not a gang member 😂😂😂 ,89
5008,KalebFirkins,160359639,Me running into the kitchen tomorrow after I smash a workout in the morning. ,77
5227,OrwellNGoode,499230066,"Meanwhile, in the UK. ",22
5228,OrwellNGoode,499230066,"Streaming now about loads of silly things from the past few days. 



",70
5229,OrwellNGoode,499230066,Maybe they could spend resources on... uhh... actual policing. ,63
5230,OrwellNGoode,499230066,LMAO the NPC meme has made it to the fitness community ,55
5231,OrwellNGoode,499230066,Why do people hate journalists? ,32
5232,OrwellNGoode,499230066,"“It’s OK to be white” has its own Wikipedia entry. What a time to be alive! 

 ",79
5233,OrwellNGoode,499230066,Dunno whether to laugh or cry at the comment ,45
5234,OrwellNGoode,499230066,Just when you thought the UK police couldn't become any more of a meme ,71
5235,OrwellNGoode,499230066,Only cowboys should get to say it tbh ,38
5236,OrwellNGoode,499230066,It's ok when they defend their borders ,39
5238,pupyeoI,1096959637,Hes my little spoon  ,21
5460,Rhinocerization,38241210,"And so begins an all too brief window of self-care. From an atheist, goodnight.🌟🌛
",82
5461,Rhinocerization,38241210,"The public health, fitness, highway safety and apartment window safety programs in Russia seem lacking, or ineffect… ",117
5462,Annieleasee,625272382,When you're about to give up on your workout but then sicko mode comes on ,74
5599,jonxstroud,393311637,my workouts gotta match the amount of stress i experienced in that week ,72
5660,partisipantwitr,3002966360,"#FotoProfilBaru
oh god,.. gym leader jasmine and her mega steelix !!!! xD
time to play the game! ",97
5899,NickEfthimiou,181076849,"I just finished up teaching a client how to lift and program kettlebells for general fitness.

Via the power of the… ",117
6376,drtollett,12971832,Because every pre-Thanksgiving cycling workout should include gelato or chocolate... or both. ,94
6397,AssholeMovies,2902715992,Writing out Christmas cards and wondering why envelope glue tastes  so bad. ,76
6398,AssholeMovies,2902715992,"“I remember when it used to be like, ‘He's the next Will Smith.’ Now I'm the example of the next—they're looking fo… ",117
6399,AssholeMovies,2902715992,"Just a friendly reminder: Peppermint isn't as Christmassy as it sounds
 ",72
6400,AssholeMovies,2902715992,"Whoa, too much awesomeness: Martin Scorsese and Spike Lee posed for a photo together while attending The Museum of… ",116
6401,AssholeMovies,2902715992,"Beauty pageant queens: Eva Longoria, Gal Gadot, Priyanka Chopra, Halle Berry ",77
6402,AssholeMovies,2902715992,"Amandla Stenberg is mixing patterns and talking The Hate U Give
 ",65
6403,AssholeMovies,2902715992,Hugh Jackman happily accepts the Santa Barbara International Film Festival’s Kirk Douglas Award for Excellence in F… ,117
6404,AssholeMovies,2902715992,"Robert DeNiro, Martin Scorsese and Leonardo DiCaprio pose together at the Museum of Modern Art’s 11th Annual Film B… ",117
6405,AssholeMovies,2902715992,"Sarah Silverman is clearly still in Vanellope mode #RalphBreaksTheInternet 
 ",77
6406,AssholeMovies,2902715992,"Michelle Williams and Rachel Brosnahan take in Saks Fifth Avenue’s iconic holiday window 
 ",91
6407,AssholeMovies,2902715992,Someone dusted off his tux: Brad Pitt at the Breitling Squadona Mission event on Tuesday in Beijing. ,101
6408,AssholeMovies,2902715992,"We're bundled up like sherpas here but Mindy Kaling gets to go to lunch dressed like this
 ",91
6409,AssholeMovies,2902715992,"Sofia Vergara is already in the Christmas spirit. If you'd like to maintain yours, or just a general good mood, may… ",117
6410,AssholeMovies,2902715992,Brie Larson and Jamie Foxx on the set of Just Mercy; Michael B. Jordan also stars and produces ,95
6411,AssholeMovies,2902715992,"Rami Malek takes in a basketball game
 ",39
6412,AssholeMovies,2902715992,Anne Hathaway is sparkly on the set of The Last Thing He Wanted in Puerto Rico ,79
6413,AssholeMovies,2902715992,When do you start watching holiday movies? Are you in the spirit yet or are you more of a #Grinch ?… ,101
6414,AssholeMovies,2902715992,"Christmas Wedding Planner: because the holidays are no time to have pride. Or dignity.
 ",88
6495,kandiii_t,263021854,Doing some baby yoga tonight 😂 ,31
6496,kandiii_t,263021854,HAPPY FIRST BIRTHDAY SWEET CAROLINE 💕 ,38
6512,mckenzyeconner,331962160,Finally Filmed My Workout Routine 💙,35
6688,UrbnHealthNP,115133905,"Good advice. 

'For a healthy Thanksgiving, treat it like any other day and your gut will thank you.'… ",103
6689,UrbnHealthNP,115133905,"The wisdom of Witch Hazel.

""The history of witch hazel is rich; Native Americans have been using it for medicinal… ",116
6690,CarmenMills,23717611,Cycling is dangerous. Being alive is dangerous. Motion comes with risks. ,73
6691,CarmenMills,23717611,People! That ProRep voting envelope under the pile of stuff in the corner? FILL IT OUT AND MAIL IT. It will take yo… ,117
6710,OParenting,2307201312,#HappyThanksgiving a bit early as I'm unplugging tomorrow 🏡 May all of you have a loving day. It's so great what yo… ,117
6711,OParenting,2307201312,Friendly reminder. #parenting #family ,38
6712,OParenting,2307201312,Affirmations aren't for making the impossible happen. They are for every day living to go be easier. #parenting… ,113
6713,OParenting,2307201312,De-stress Wednesday. Do you realize how shallow your breathing is when stressed? Do this and imagine the feeling of… ,117
6714,OParenting,2307201312,Emotions start running higher around the holidays. Pause. A lot. #parenting #momlife ,85
6735,AzrinFahrurruzi,1697120689,"Far more rewarding.

",21
6736,dphil2047,24932721,"Happy Cranks-Spinning. 

Remember, if you don't like the bike lane, simply hop up onto the #sidewalk, run a red lig… ",117
6737,dphil2047,24932721,What are the reasons cyclists ride on #sidewalk? Personal safety? Heavy traffic? Dangerously revving engines?… ,111
6738,jhlftball,422282419,Counting down to the Patriots Strength and Conditioning gearing back up with Deadcember workouts! ,98
6739,newman_lacey,752557345,Tattoos for the next coming year😏 ,34
6740,newman_lacey,752557345,Badass workout today and good walk at the park 😏 ,49
6849,thatboiserg13,2913379542,Workout mood 🤘🏽 ,16
6850,thatboiserg13,2913379542,Add the snap my need new people to talk too my phone be dry af ,63
6851,thatboiserg13,2913379542,This right here is what you call heaven on earth 🔥 ,51
6852,thatboiserg13,2913379542,If y’all need some motivation here’s some ,42
6853,thatboiserg13,2913379542,This song is gold 🔥 ,20
6894,KevinWM85,27968340,Can't wait for all the thanksgiving retweets tomorrow of muscle queens acting fat for attention. ,97
6895,KevinWM85,27968340,When I'm really hungry and the waiter keeps walking by my table with other people's food. ,90
6896,KevinWM85,27968340,Me voting in 2016 vs me voting in 2018 ,39
6974,CrossFitZwolle,828979099,"WOD: Donderdag 22 november 2018

WOD#1

Gymnastic skill

Toes to bar

20 min

WOD#2

”Lowlands Throwdown 2018”

Op… ",116
6975,CrossFitZwolle,828979099,"WOD: Vrijdag 9 november 2018

WOD#1

”Fight Gone Bad”

3 rondes op herhalingen

20/14lbs Wall ball shots, 1 min
32,… ",117
6999,harryblake162,2891324728,Just used the app from  to report mutiple potholes in my town. Shame to see that… ,82
7000,harryblake162,2891324728,"Yeah boiiii!!!! First rugby game so may as well make it at Twickenham, thanks mum and dad! #birthdaydayout #rugby… ",115
7001,harryblake162,2891324728,"When you don't live by the mountains, you feel so lucky to catch a good day of weather. Today was definitely one of… ",117
7002,harryblake162,2891324728,"Trying to fall back in love with cycling by taking the long, wild way round instead of just straight home on the ta… ",117
7240,LeahHandville,335685829,Always  ,8
7241,LeahHandville,335685829,When your workouts for the week completely got erased by one pint of ice cream #icecreamwins #pineapple… ,105
7242,LeahHandville,335685829,Had a few fist bumps today!! Totally trying the Baymax fist bump tomorrow 😂 ,76
7275,therealkoachp,205381098,Trying to workout tonight...but My daughter is holding me hostage. ,67
7558,The_Kman_Did_It,4883339067,"So to understand this commercial, Frank Thomas takes nugenix so he has enough testosterone to threesome divorced su… ",117
7573,YoursTrulyKayla,290593754,gah nachos bell grande is my weakness ,38
7574,YoursTrulyKayla,290593754,the only time i crave taco bell is when i come home...which is delaying my fitness goals ,89
7722,fascinantae,356628828,jeongguk is a living muscle i swear ,36
7723,fascinantae,356628828,okay but does he really sleep like this???? im???? its not fair??? ,67
7724,fascinantae,356628828,good good good morning everybody!!! i hope you have a wonderful time today ❤️ ,78
7725,fascinantae,356628828,vampire vantae pls suck my blood ,33
7746,Neopold,139079567,Late night gym time ,20
7747,Neopold,139079567,Is it wrong that I want an adult sized one of these for when I redo my house? #distracions ,91
7748,Neopold,139079567,This makes me miss Algonquin.  // trulyvincent: Canadian genius Tom Thomson - ,78
7749,Neopold,139079567,Loved this quote from “The Marvelous Land Of Oz” tonight while reading with my son. #beunusual ,95
7750,Neopold,139079567,Sometimes a song gets in your head and hits you deep down. Thanks music// Justin Timberlake - Say Something ft. Chr… ,117
7780,halloptik,1111368870,"Love cycling to Yotto's music.
",31
7781,halloptik,1111368870,I've got a lot to catch up on ,30
7853,AbellOfCereall,2193283512,If you want a great workout set ,32
7854,AbellOfCereall,2193283512,The road to the Super Bowl is getting shorter and shorter! #WhoDatNation @Saints ,81
8323,Rad78Duran,4855180312,Me debating driving in this rain to go workout... ,50
8472,maureencaught,272474550,Earn that stuffing! Here are some Thanksgiving Day Workouts in the Neighborhood! ,81
8473,maureencaught,272474550,"Thinking about heading out on #BlackFriday?
Heather has some thoughts about that! ",82
8474,maureencaught,272474550,Nothing like rippin' it up on Thanksgiving Eve!  Live music at The Supper Club at Capo and legendary #Southie DJ Dr… ,117
8494,absolutPHILth,39254232,"The time has come, the walrus said, to speak of many things.
Like little shorts and slogan tee’s and the cramps thi… ",117
8495,absolutPHILth,39254232,Winter food though ,19
8496,absolutPHILth,39254232,"The past couple of years have taught me a lot about self preservation.

For each person who looks at me weird for b… ",117
8497,absolutPHILth,39254232,Tilly really wants her tea ,27
8677,whereisria,275839349,Mended our frayed Christmas table runner. Putting points into my domestication skills. ,87
8678,whereisria,275839349,My enamel pins have a new place! ❤️ ,36
8679,whereisria,275839349,Felt indulgent this morning and overdid my brunch. I need more veggies. 😂 ,74
8680,trishajanell,150759968,Tonight's workout! 12:56 💪🏻☺️ ,30
8681,trishajanell,150759968,Pretty proud of my time! Done in 19:52!! ,41
8682,trishajanell,150759968,My family💗🤣 @ Dakota's Steakhouse ,34
8683,trishajanell,150759968,I love this guy so much and am grateful for him❤❤❤ ,51
8684,trishajanell,150759968,These two💗❤💗 ,13
8724,Yogainthewild,2606231983,New dates are set for our 2019 Yoga Retreats!  Save 15% on registration through November 30th.  Enter EPIC2019 at c… ,117
8725,Yogainthewild,2606231983,"Combine your two loves, hiking and yoga, in an epic and awe-inspiring setting! Book by August 31st and bring 4 yogi… ",117
8796,SAHikari,608510612,"Dealing with a stupid cold rn. :( And because I'm so pregnant, it's made me bed ridden, barely able to lift myself… ",116
8797,SAHikari,608510612,"Ordered a bunch of baby stuff on Amazon, baby shower done, only a few more weeks to go! ",88
8798,SAHikari,608510612,What the heck is going on with sweetie belle ,45
8817,jarieVee_,250367484,"The clock is running out, ⏱ and the time to BUNDLE UP has come. It’s Black Friday, and #TheJarieVeeCollection 💕 has… ",117
8935,wxrxwolf_,375094843,waking up every morning with a muscle aches ,44
8936,wxrxwolf_,375094843,GITU PON COMEL APEE SIAAAAA ,28
9077,HennyTweets,191491115,Great running into Toronto’s Oliver Spring tonight. The Duke senior ends his collegiate soccer career with a last r… ,117
9078,HennyTweets,191491115,Ron Hainsey played 300 games as a Hurricane. He’s a Leaf now and co-leading the NHL in plus/minus at plus 13. Photo… ,117
9079,HennyTweets,191491115,Kappy Days in Carolina. Kasperi grew up around this rink 16 years ago when Dad Sami played for the Canes. Photo cre… ,117
9080,HennyTweets,191491115,Steady and ready is Freddy ! He’s won his last 6 starts and gets another tonight. Thank’s ⁦@nicoleburns77⁩ #tmltalk ,116
9081,HennyTweets,191491115,Jake Gardiner is enjoying warmup tonight. Jake has played 20 plus minutes in 12 of his last 13 games. Photo cred ⁦… ,116
9134,rahemya,431751768,#HowHardDidPuberityHitYou ,26
9194,j_holtslander,17420708,Dark rainy night commutes are great for the Blade Runner 2049 soundtrack. ,74
9195,j_holtslander,17420708,There’s more even! ,19
9368,thecodydeal,30173956,"Nothing better than a beautiful workout, where mind and body are so coordinated that it feels like meditation. It’s… ",117
9369,thecodydeal,30173956,Don’t let a day go by without a smile. Happy Turkey Day tomorrow 🦃. Love you ALL. 😘 ,84
9370,thecodydeal,30173956,It’s hard when you feel like giving up. Mentally or physically. It’s why I train so diligently physically. Because… ,116
9371,LisSaunders,19025874,Yesterday I talked with strong woman Corbin Bruce about the loss of her husband and coping with grief &amp; anxiety by… ,120
9372,BreakUrChains,316422005,Best Post-Workout Foods -  ,27
9373,debeerliz,2389091868,"A Preacher, a Yoga Teacher and Me  ",35
9374,debeerliz,2389091868,"Although this guy refused our materials, we had a great day canvassing in #FairHavenNJ #Monmouth to #GOTV… ",107
9375,debeerliz,2389091868,Gorgeous Weekend to GOTV for @AndyKimNJ It's an honor to support such a fine candidate. #VoteNov6th #VoteBlue… ,111
9648,AlexxEdrolin,38656444,shawtyyyyss out there to support this nigguh who got 1st runner up 🤙🏼 ayyt ,75
9649,AlexxEdrolin,38656444,"kining mga bataa ni, way mga lingaw hahahaha manawag ra unya kalit syagit...

""PRESIDENT!"" saybit dayun, ""LIBREHA M… ",117
9650,AlexxEdrolin,38656444,one love 💕 ,11
9843,jerrydelacherry,1293715764,welp I just got a membership at LA Fitness ,43
10254,RunnerIzzy,93916996,"Flat Izzy is pumped for a special Thanksgiving workout at otfnona tomorrow! I’m not doing a Turkey Trot this year,… ",116
10255,RunnerIzzy,93916996,Still riding the high from this weekend’s half into #medalmonday as we head back to Orlando. Such a great race and… ,116
10333,2hundredM,454583191,Road runner ,12
10457,PeterKispert,942731988,I paid for a fitness app that offers unparalleled insight into stretching technique. See here instructions on how b… ,117
10458,PeterKispert,942731988,My nephew says pls don’t bother me I’m reading (this glam pose!!!) ,67
10459,PeterKispert,942731988,Poking through Scrivener and saying “now what the hell does this do?” on a loop while eating this incredible ice cr… ,117
10460,djfoster08,1931328998,Actual video of me during my run tonight. Man it’s cold ,56
10461,djfoster08,1931328998,Cold and Windy but got it done  ,32
10462,djfoster08,1931328998,I think Alexander Dreymon from the Last Kingdom would have made a good Geralt of Rivia ,87
10655,DozOfTheDino,154001345,Me going through the fitness gurus  “healthy thanksgiving recipes” stories ,75
10696,RobieCur,1518291409,This Fitness Blogger's Latest Post Will Make You Feel So Much Better About Cheat Days  ,87
10824,SheepdogSecurit,4389029254,"A member of a new cohort of young, “progressive, diverse” representatives who purportedly represent the future of t… ",117
10825,SheepdogSecurit,4389029254,"Sad To See This. Ilhan Omar, newly-elected U.S. representative from Minn’s 5th congressional district member of lef… ",117
10826,SheepdogSecurit,4389029254,"Considering her record, documented history of poor ethical, moral fitness, outrageous Maxine Waters up for chair of… ",117
11067,PrfctGF_Quote,1870306556,Things That All Girls Should Have -  ,37
11068,PrfctGF_Quote,1870306556,Top Shocking Champions League Results -  ,41
11069,PrfctGF_Quote,1870306556,Chris Brown’s Best 2013 Moments -  ,35
11070,PrfctGF_Quote,1870306556,Top Workouts for Perfect Abs: ,30
11071,PrfctGF_Quote,1870306556,Cute Cupcake Ideas: ,20
11072,PrfctGF_Quote,1870306556,Celebrities Turning 50 in the New Year: ,40
11073,TFIOS_BookFiIm,1870249884,Best Post-Workout Foods: ,25
11074,TFIOS_BookFiIm,1870249884,Most Dangerous Animals In The World: ,37
11075,TFIOS_BookFiIm,1870249884,Is He a Player?: ,17
11076,TFIOS_BookFiIm,1870249884,Beautiful Abandoned Places -  ,30
11077,TFIOS_BookFiIm,1870249884,Skinniest Celebrities -  ,25
11078,TFIOS_BookFiIm,1870249884,Real Life Barbie : ,19
11194,mspaisleybrown,629053646,came to the spa room at school so I could lay down and juul indoors all while casually doing booty workouts ,108
11235,JChombe,67804043,Did yoga for the first time. My god ,36
11305,oh_its_beccccc,1944488851,"I’ve been doing great I guess I can't complain
I don't think about yesterday 😇 @ Mesquite, Nevada ",98
11670,AlexCarsonx,41478616,Happy October :) ,17
11671,AlexCarsonx,41478616,An accurate depiction of me everyday ,37
11672,AlexCarsonx,41478616,Motivation ,11
11688,Kavinay,34935574,"Workout duration /
Often long as Queen album /
Not coincidence.
#haiku #DynamiteWithALaserBeam ",95
