index,screen_name,user_id,tweet_text,length
11717,itsallaboutyou0,318584854,Honestly my diffuser is a life saver at home and work. It’s all about Eucalyptus and Tea Tree oils at the moment to… ,117
11718,itsallaboutyou0,318584854,It’s the little joys in life. I’ve recently been trying out our new bamboo #ecofriendly toothbrushes. Today Thea as… ,117
11719,itsallaboutyou0,318584854,Wishing you all a #HappyEaster. ,32
11720,woainiell,4439282293,"are u sure ong seongwu, kang daniel is that man who u felt intimidated and scared at the 1st sight, leaving bad imp… ",117
11813,curlybecs,16431556,Some people were promised jetpacks. I was promised euphoria post workout this eve. Still waiting ... ,101
11814,curlybecs,16431556,FFS ,4
12081,Barrettdj,160044098,‘Motorists really are very aggressive and selfish’ – 1973 documentary #biketo #cycling  ,88
12082,Barrettdj,160044098,Drooling #bikeporn ,19
12083,Barrettdj,160044098,"FERC nominee McNamee slams renewables, green groups in Feb. video ",66
12084,Barrettdj,160044098,"Luckily for Trump, Ocasio-Cortez Can’t Run for President in 2020 ",65
12085,Barrettdj,160044098,Canada: It’s time to stop supporting this regime #cdnpoli  ,59
12464,kurtmichaelis,281007585,This training took this 38 year old to a 4:40 mile last yr w/o hammering speed and only doing 40 miles per week. It… ,117
12534,serlindsipity,16042188,Yoga in a indoor butterfly jungle. The best thing ever ,55
12764,PamelaPLN,37197320,Survivors of Anthracycline and Radiation Therapies ,51
12770,KainHGG,56637602,"I'm at Energy Fitness Pericoapa in Tlalpan, DF ",47
12811,kscincotta,19791829,The long runs are done. The rest of the training was.... non-existent. But hey! Let’s run a half marathon tomorrow… ,116
12812,kscincotta,19791829,"Literally every time we’ve run over this bridge for the last year, #Dashtag has reminded me of this and told me to… ",116
12925,irrelevant_emmi,2740502884,"Just did squats, y’all better watch out 👀 ",42
12926,irrelevant_emmi,2740502884,Omg I’m STRESSING about the food tomorrow. This is gonna be the first time me and my sisters are making the food ,113
12927,irrelevant_emmi,2740502884,My aunt said she’s also going to cook a turkey when I told her I was cooking it this year ,90
13219,one_optimistic,1517098675,I want to sleep but i gotta do these workouts. ,47
13220,one_optimistic,1517098675,Lately i gotta be covering up my neck at work ,46
13221,HansaVaria,592226249,A holistic take on #Health and #Wellbeing So much truth in this and a reminder to look after your #MentalHealth and… ,117
13222,HansaVaria,592226249,"Happy Diwali - may you all be blessed with Health, Happiness and Properity 🙏🏽 #DiwaliCelebration #Diwali… ",106
13223,HansaVaria,592226249,Really pleased to see these notices in the toilets and positive steps being taken against these types of abuse at… ,115
13330,WeaselSteve,43982905,"Iron, like a lion, in Zion. Warmeister is changing his body. 
1.)45 min. incline walk w/ 35lb vest
2.)4 min on assa… ",117
13331,WeaselSteve,43982905,I’ve got the perfect sweetener to put in your coffee☕️A fresh new episode of the Weasel’s Tale Creepcast🎙I had the… ,116
13394,Adrianoathstep,19048959,Gym time 👌🏻 ,12
13395,Adrianoathstep,19048959,Hey boy hey girl 😏 ,19
13396,Adrianoathstep,19048959,"DUA LIPA EN BOGOTA // FESTIVAL ESTEREO PICNIC 2019 #FEPX 
5 DE ABRIL, 2019
Que felicidad!!!!
",93
13466,HeaterShield,2963280978,"Fitness coach, Culver Padilla!💦 #PBBOtsoNa ",43
13467,HeaterShield,2963280978,Oh Pietro!😍💦💦💦 ,15
13620,Jesse_Arreola,612934580,I hate cardio but i hate being fat even more. ,46
13621,Jesse_Arreola,612934580,We love a poem ,15
13622,Jesse_Arreola,612934580,💦💦 ,3
13662,lizlauren11,4781619493,When I have a smoothie post workout ,36
13786,KibetBenard_,636025446,"#TatuCityLiving ; Tatu City is aligned with the vision of the Nairobi Metro 2030 Strategy, and part of Kenya Vision… ",117
13787,KibetBenard_,636025446,Tatu City recently off-set 300 acres of industrial land out of the 450 acres it had allocated to this segment and h… ,117
13960,b000giebear,24408840,I feel like a real fitness girl in my matching fashion nova knock off two piece. ,81
13961,b000giebear,24408840,"Need to get into contact with Apple so I can access half the things in my life again. Y'all, write your passwords d… ",117
14308,bofatier,2163896156,I went to the gym with my bro and his bro and I did my warmup and workout but they're jocks and still working out s… ,117
14309,bofatier,2163896156,I know its just for being thorough and I respect that but the 3rd and 4th tags arent necessary ,95
14310,bofatier,2163896156,Yall should use my Ibotta referral code ,40
14311,bofatier,2163896156,A take ,7
14442,Rambo_333,377081701,Slowly implementing a cutting phase. Giving my body a break on the high calories for a while. Cardio 3x a week and… ,116
14443,spotswoodcc,564278132,"We’re excited to be hosting #SocialSixes at SpotswodCC from next Thursday 6pm! 60 minutes of fun, fitness and crick… ",117
14444,spotswoodcc,564278132,"Unbeaten First XI, Strength in Numbers, and more - ",51
