index,screen_name,user_id,tweet_text,length
4,Morbid_Madame,2201552023,This is also one of my old pieces this time in Watercolours. It's of a demon sucking a soul out of this person.… ,113
6,DinkarNepal,70611657,"Bird Watching today led by Bishal Acharya and the team. See you in a while.

भेला हुने : भुम्रेको पुलमा, 7.30 बजे। ",115
10,ThePippyCo,19049407,"FALL FASHION IS HERE! Stop Staring new fashion for the new season is available at  #romper,… ",93
11,CalgaryCulture,55278625,"#HotTicket Alert! Enjoy a night out filled with comedy, music, burlesque, cabaret, and more, this month’s… ",107
12,nollywoodmovies,65604908,Watch Nollywood Movie: King Of Boys Season 2  ,46
14,JPPrice,19629769,New at HSR: Allen open to adjustments in 2nd season  ,53
16,DKorecki,402542955,Watching #TheGymkhanaFiles ,27
18,Bessytwits,37529099,"When I was in Greenville, I worked on an indie feature film called #tinker it was like a calling when I sent my res… ",117
22,ismokin_hot,622898152,I just finished watching The Fall! #tvtime  ,44
38,Pandax_cat,2536358693,My sister really be watching the Coldplay documentary without me smh😔 it really be your own kind that turn on you. ,115
42,ipmNation,148972614,"I uploaded a new episode, ""Matt Connarton Unleashed 11/16/18"", on #spreaker ",76
44,rosesweettweets,2422591032,RIP  ...Your movie taught us the beauty of self-sacrificing love in mawwiage!!! ,80
45,TheGoodGuyRob,191698985,Watching last nights law and order #SVU episode looks the shoe is on the other foot ,84
46,Packerville,321815933,"Here are the Week 11 NFL TV Maps... the games that you’ll see in your area, if you still feel like watching footbal… ",117
49,Gomidog,16042744,Hilda (the animated show on Netflix) is an absolute delight! ,61
53,Anvkii,29825763,"My favorite dates aren't leaving the house to see a movie, or gaze at the stars, or even a weekly sit down of watch… ",117
55,IsaacsHauntedB,2184095418,"Last night's film:
HEREDITARY ",30
61,7News,16558796,Aretha Franklin’s ‘Amazing Grace’ film finally in theaters ,59
63,Deanna2001,151291936,"Screening of the 48 hour film project at the Landmark Main Theater in Royal Oak, Mi. Go Team #LivingNightmares ",111
65,melissa_harper,16223358,When watching ghost busters.... 😆 ,34
67,ShelbyMarshall0,717372794,Love lazy days curled up on the couch watching movies with my baby. 💓 ,70
71,IAC_USA,885683660,"Dad and Son - Movie and Dinner Night, after a long time — watching The Grinch at Regal Village at the Peaks 12 &amp; RPX ",121
74,JoshepAyya,124672114,"RT TIME ""Here's how to hack Netflix and directly access its full catalog of holiday-themed movies ",98
76,BlackRoseTrc,2763215131,found that film I was looking for... ,37
85,damienrecords,39915851,Silent Film ★ Lillian Gish DVD collection ~ 30 DVDs / 36 films ,63
92,judesmaiada,45882583,I just finished watching The Staircase! #tvtime  ,49
97,diopter,24997508,"I worked here while in college, mid-90s, on West 14th. He was an encyclopedia &amp; the definition of “a character.” RI… ",121
99,Methylix,18279368,"weeeeee 
First time watching the fanfest live! ",47
102,ashleyhepburn,21940485,"Onya watching her new favorite movie alphathemovie She normally barks every time she sees animals on TV, but she wa… ",117
106,RockinDavid,548367126,my religious friends and family watching my stories yesterday ,62
110,acephalemagic,41302353,"Watching. Like how it's keeping us guessing.
",45
113,angelotijssens,440734187,"Great man.
And a great piece, Peter Debruge. ",45
115,sttorrmmyyy,2322871465,"“i’m watching you, wazowski. always watching. always” 😂😂 ",57
117,vanessa_issa,61527657,I guess I'll spend the rest of my life just watching xmas movies 🥰,66
122,chinosikevin,602314910,"Short horror story:

Not all humans are monsters, but all monsters are humans. ",79
123,TritiaPOCCI,96477730,"RIP WILLIAM:
#Filmmaker
 ",25
124,PotatoRomeo,2777169714,"I lied about not watching another episode today.

Raishan | Critical Role RPG Episode 80 ",89
125,BindaWarren,4887781105,This soup is to die for I can't weight soon I will be 25kg lighter and then new foto shoot and film clips. The less… ,117
127,JustMePammy,34993057,"film. "" Voyage Of The Damned "": ",32
128,MovieKessler,2817034059,"Hey, Alexey German Jr.'s Dovlatov is on Netflix. I'm going to watch it right away!

",84
129,rjinnella,10249662,Watching  something — at Roys Den ,34
131,homeandplate,2842739745,"Elderflower Bellinis | For this peachy favorite, Elderflower liqueur is the star of the show. It's t ",101
134,dylanb4decaf,22859153,Look who I found while watching FBI Files ,42
135,sanayeonsus,1085810887,watching this vlive and crying over how adorable 2na is ,56
146,mateopagina,1637312084,"The Princess Bride. Misery. Butch Cassidy and the Sundance Kid. All The President's Men.

Thank you, Mr. Goldman. ",114
147,JonOnAString,45730229,TIL: Dario Argento's close-up shots of the killer's hands were usually his own. Neat! #horror ,94
150,KaraDyanJokes,2901039660,Come laugh with me this Sunday universal_bar_grill *8:30p* 4093 Lankershim BLVD. N. Hollywood 91602  Hosted By… ,112
151,Packerville,321815933,"Here are the Week 11 NFL TV Maps... the games that you’ll see in your area, if you still feel like watching footbal… ",117
153,RebelleRogue,112639065,Watching Making of A Murderer and baaaabeeeeee ,47
158,ABleedingCorpse,59981169,"Tonight I was watching 'Waiting...' (2005) and a thought in my mind said, ""Damn, I miss Dane Cook in stuff."" 

And… ",116
159,natejundt,17242660,Hard to not be a Jason Gore fan after watching this interview:  ,64
160,VK_HM,973799466,"Roger Ebert would object to the titular character's name, saying Buster was not a first name until Buster Keaton. (… ",117
161,WilliamBurdine,109397412,Celebrating 5 weeks of training with great people and mentors. — watching Bohemian Rhapsody at Edwards Temecula 15… ,116
162,RCRreview,3829236088,Devil May Cry Series Coming From Castlevania Netflix Producer [Correction] ,75
163,opusipuk,4873590352," Jared Leto Says 'F— It' as He Shaves His Beard for Role in Spider-Man Spinoff Movie 
Jared Leto Says 'F— It' as ...",116
166,vaccbann,826009272,When you do drugs and end up watching weird ass documentaries: ,63
167,ufusn,252739631,#humanbeingtour Loved the opening acts at the John Crist comedy show. Here comes John!  So excited! ,100
168,ThePayneMan,375784020,"We got a new Mariah album, I just got done watching that Genius interview, and she’s writing a book about her life.… ",117
170,just_jabu,469377135,"I can't believe I just spent 6 minutes watching this 
",54
172,denandbecky,1958697577,"With Mimi &amp; Scott Tyler watching SS Mav's vs NLR Charging Wildcats. Go Mav's, Go #31 Jake Tyler. State playoffs. ",117
175,Fatalmephisto,84509248,So The Forest is the best survival horror game ive ever played. ,64
176,peterboykin,24493104,"I uploaded a new episode, ""Hand recount ordered in Florida as accusations fly; WikiLeaks founder Assange could be c… ",117
178,beautifuIrise,4887853214,GOOD MORNING i’m watching burn the stage today and i’m so excited ,66
181,zingars_,2972957083,"America is watching as Democrats are boldly stealing elections outright.

This trend must not be allowed to stand,… ",116
185,TheLoftCinema,71315617,"See the unrated Director’s Cut of Lars von Trier’s controversial new horror thriller, #thehousethatjackbuilt at a l… ",117
193,winterChandelur,2850545080,Watching the largest there way and just saw the Frank and Ryan for a breef moment where fighting the same pokemon ,114
194,ajthigpen0321,541276568,Fans Want Deadpool To Take Over Stan Lee's Marvel Cameos ,57
195,HarryTheCarry56,1416872906,The Soon To Be Best NA Player Is Back On To Show You All How ,61
198,DHDIII,19144925,"Oh, it’s on. After binging every season of #HellsKitchen I decided to try a Wellington for the first time.  And it’… ",117
207,LACarlos,16588430,Moving to a new home in about 14 hours and this is the last thing up in my office. I’ll forever be proud of this ba… ,117
208,TheBamCast,255571041,"Yo, pre dis
I came in home jamming to music and mad happy wondering what am I gonna do tonight because I had no pla… ",117
212,tingilye,35476316,"Mr. Rajapaksa stood by in the chamber, watching as his allies rampaged as they had on Thursday as well. After the v… ",117
213,fringeblog,13476212,"I haven't had as much fun at the movies in a long time as I did at #OverlordMovie. Such good, pulpy action/horror! ",115
216,JMehlbauer,1568444574,Netflix and chill means Netflix and chill ,42
221,macsnider,18567270,"I've seen Bohemian Rhapsody, 2018 - ★★★★★: ",43
223,macsnider,18567270,"I've seen Fantastic Beasts: The Crimes of Grindelwald, 2018 - ★★★: ",67
224,Slate,15164565,The agony and ecstasy of watching Jeff Flake’s every move:  ,60
225,DaxerBlade,3131229748,LMAO I DIDNT EXPECT THAT IN THIS NEW EPISODE OF BOARDING SCHOOL JULIET 😂😂 ,74
226,Namaste2525,1592674021,Feel like watching “My Cousin Vinny” again for movie night this weekend. 😁😁😁🍃💕🙌🏽🤣🤣🤣🍃💕🙌🏽😁😁😁 ,91
227,S_DizzzX,2437859388,This anime looks worse everytime a new episode comes out. ,58
228,issa_belm,381784260,I found a film camera at goodwill with some film in it and I recently got it developed...AND IT’S SOMEONES BIRTH PI… ,117
230,Jarrett_tdr,4746221477,I am watching Netflix’s Dogs. ,30
234,zalesky3,260030088,"Growing up racing was a huge part of my life. Saturday nights were spent at the dirt track watching my uncle Hal, t… ",117
236,vinyIariana,374784017,i miss skam so much can it come back with a new season ,55
244,PauloBHz7,73119679,I just finished watching Sense8! #tvtime  ,42
245,mryeatts,232757410,"The horror, the horror. ",24
252,sungmiiina,2429970516,WAAAAAH WATCHING MY BABIES MAKE KIMCHI RN 💙💙💙💙 ,47
255,CheriStories,237958347,Gemma Chan wears a Prada Resort 2019 suit &amp; top at the 34th Film Independent Spirit Awards Nominations Press Confer… ,121
265,LaLaKristiansen,163999674,"Johnny Depp, Nagini Controversies Don’t Rattle ‘Fantastic Beast’ Fans – Variety ",80
273,merosskimball,14930202,When 3 people explain to me why I have to start watching Friends from the beginning after I tell them I’ve never se… ,117
274,cbbruuno,2508114499,"Currently watching-
1990: The Bronx Warriors (1982) ",52
275,intotheballroom,491822335,"

Christian Frommelt recent inquired about precursors to Shag and  this really fantastic cli… ",94
278,AProudSachinist,1088537832,"When people say that best friends are not made after college,I show them this pic. Happy birthday bro. Love you ❤️… ",116
280,collgibson211,139937568,"The Birdcage is a cinematic gem, and one of few movies that will make me laugh endlessly without fail.

Guess what… ",116
287,bluebatbones,1470904722,Netflix and chill with my baby ,31
290,sportybabe,26369191,Why Ex-Patriots Exec Believes New England ‘Is Not A Good Team’ This Season | New England Patriots |… ,101
291,MiriamHand,397580927,Butch Cassidy and Princess Bride scriptwriter William Goldman dies aged 87 ,75
295,nzonscreen,22580958,"Daffodils is a feature film version of an award-winning Kiwi stage musical, starring Kimbra, Rose McIver and George… ",117
297,cejuma,24199309,Thanks for this feature Au letch. Just a few more days to support the The German King Movie Indie GoGo campaign:… ,114
301,BU_NeonHat,20285104,Ole Miss’ coach watching his team travel all the time ,54
304,MJARohr,2251030782,I have been a Redskins fan since I was 4. My older brother was a Dallas fan (he is cropped out of this picture) and… ,117
310,tmj_nvr_cosmo,47838427,Ulta Beauty is in an incredible season of growth and we’re looking to add a new Specialty Beauty Advisor to our tea… ,117
312,smartstepstoaus,4502443452,This sounds awesome - will be watching out for a boys version in the future ... ,80
313,NEWSANTANDER,3579302842,BREAKING: London Bloodbath – Women attacked with machete in Charlton HORROR attack  ,84
316,FollowingBliss1,1385675696,"I hate found footage #horror, but this looks good

",51
320,EmproDaBoB,35889461,Me after watching Jill Scott's oral skills ,43
321,WTLTE,18068073,My wife watching the new She-Re on Netflix. She hasn't moved in 20 minutes. ,76
322,skierssportshop,139201335,The most fun you can have without skis on your feet... Skiers Film Fest Part 2 tomorrow night! #skiersnation… ,110
324,kingstarbd,3100065758,Netflix has a hidden Stan Lee tribute and it's awesome. Lee passed away earlier this week at the age of 95. While h… ,117
327,FetzerBen,285857181,Perspective: Watching my soon to be three year old son. Pack a box for another 2-4 year old boy with soap and essen… ,117
329,VistaPrincipal4,1408172082,"Congratulations to this incredible young lady who will be playing D1 hoops at New Mexico State next year, while ear… ",117
331,WonderMonkey78,21199235,Wow. This really made me sad. Like watching the ending to “Stand By Me” sad. ,77
333,ShoopusMyWoopus,635396350,hey gang im watching hells kitchen and if this isn't a mood ! ,62
338,AnthonyOMiller,237098304,"Wife grabs remote*
Me: I’m watching the Iowa game
My wife: No lets put a Christmas movie on 
Me: ",97
339,donwurun,119226187,I just liked “阿公 A Gong (Grandpa) - Animation Short Film 2018 - GOBELINS” on #Vimeo: ,85
347,drewhuntre,624664727,"#BMovieManiacs ""I don't recall being in this one. The greatest movie, ever."" ",77
353,pztsch,4187833673,I just finished watching Gossip Girl! #tvtime  ,47
354,blackjkspollock,22376139,Greg Pitts Songs | ReverbNation use this in your film or short film  ,69
355,SchmexyGrlBooks,1427148458,My commute this morning...3 hours for my normal 1 hour trip. Sat in park and watched Friends on Netflix...didn’t wa… ,117
367,AProudSachinist,1088537832,"When people say that best friends are not made after college,I show them this pic. Happy birthday bro. Love you ❤️… ",116
371,JacobHaynes2015,3098527375,One of my favorite past times is just watching my girlfriend interact with our son. I love you guys so much… ,109
374,928hendery,2854294326,watching this makes me remember who is next days 😭 ,51
376,TwisterKidMedia,260530719,On this day in 2015 I was watching several tornadoes in the Texas panhandle from a localized severe weather outbrea… ,117
381,PromoteHorror,332966388,"The Inaugural “Medusa Underground Film Festival” Announces Their First Wave of Programming 
",92
382,MoviesMovieMag,3305672398,Film: Serie - The Magicians Season 4 Trailer: The Fight To Bring Magi  #film ,77
385,jlcourtemanche,1370671201,Fantastic Beasts: the Crimes of Grindelwald! — watching Fantastic Beasts at Cinemark Tinseltown USA ,100
388,kirstenmckivor,1344988093,"Jack Frost man, that film still makes me cry every Christmas ",61
389,Payacho,23613779,watching Widows at Studio Movie Grill ,38
390,ChrisTsakis,17741070,This is the damndest thing I’ve seen in awhile. ,48
397,CourtneyNH_RD,3301102534,Pretty absorbed in watching Life Of Pets ,41
398,persiaa,27765135,New Netflix documentary series about dogs. They promise no one dies. ,69
402,DannyPOcean,70524449,‼️‼️‼️New episode this Monday‼️‼️‼️ Possibly the funniest one yet‼️‼️‼️ ,72
403,casey_jeans,1255244766,"Choose your steps wisely, for someone is ALWAYS watching you! ",62
406,WendyAtTheBay,2424304063,Really fascinating to watch these films of late 1800’s and early 1900’s. This is from 1911 in New York. Speed of fi… ,117
408,frawstakwa,591593699,📷 thebrokenewyorker212: 📷 I found a whole new love for photography since I started using film.... ,98
409,rustyrockets,19562228,"New podcast episode is up!
",27
412,vampiratropicaI,4041382821,"seu top10 filmes favoritos — 1. amadeus
2. possession
3. twin peaks: fire walk with me
4. the rocky horror picture… ",116
414,VicFlair_,246585214,Everyone without a tickets watching us go to astroworld fest ,61
416,Martycallner,39435885,"A very emotional minute showcasing Justin’s songwriting and heart. This is the most beautiful show I’ve filmed, pos… ",117
417,RiseFallNick,103396427,"Correcting an earlier tweet

Young Justice: Outsiders is for the DC Universe Streaming Service and will air January… ",117
419,lee0969,468767902,On this day in 1973 The Who's double album Quadrophenia entered the UK chart peaking at No.2..The 1979 film based o… ,117
429,eksennowplaying,3438807447,♬ Radiohead - Exit Music (for a Film) #radioeksen ,50
430,eksennowplaying,3438807447,♬ Radiohead - Exit Music (for a Film) #radioeksen ,50
433,IS3RGI,425567850,Watching havoc hockey tonight ,30
434,VicFlair_,246585214,Everyone without a ticket watching us go to Astroworld Fest ,60
438,KazuraZen,1695630548,"Just watching eps. 6

Okay there are some filler from Shinobi Versus. Asuka back to normal again. I can't believe t… ",117
439,rtdontknow,1363602042,"Folks, the entire Air Bud saga is on netflix. Lez go ",53
440,ssrmagazine,1421395351,You are  watching the one and only Ron-La of Trinidad and Tobago football ,74
441,CraigMinett,503663200,Watching Evil Dead 2 on a Friday night is the best way to start off the weekend. ,81
444,melaniekeith75,2819460976,Ugh hubby out of town.. just me and the three babies all alone watching #livepd tonight. 😔 ,91
451,bartonrg,355786504,#KohlsCourt Having a great time watching the Greek Freak!! Go Bucks!! ,70
455,phsccwildcats,2359750092,A night at the theater CLUE fun watching young talented people ,63
456,KWBrente,2918062913,Heritage assembly is always a favorite! Everyone was filled with pride as we show what America looks like.… ,108
463,seonghwq,4105973953,i started watching this show called Anne with an “E” and this guy who plays gilbert is kinda cuuuute ,101
466,Nd0uglas,2925590248,Me watching this Iowa basketball team ,38
468,PlMPF,80360487,I've just watched episode S08E10 of American Horror ...! #tvtime  ,66
472,wallywolfpacker,203050983,"Watching the Garrison Tapes for the first time...Oswald did not shoot JFK....

 ",80
477,petdank,272517698,Watching Jon die for the third time ,36
479,QueeenAfrodite,277153490,Me watching the new Greeks announce themselves ,47
483,WonderLively,3237568028,She's just chillin and watching tv ,35
488,STEFisDOPE,29271423,"Since Netflix just dropped this new season of Narcos, peep this instrumental I produced sampling the show’s intro m… ",117
497,rebornemmanuel,3029106766,Kid Cudi being the musical host on Comedy Bang Bang for a whole season was the peak of television ,98
499,DigitalTrends,14763734,"Comedian Craig Conant discusses sobriety, comedy, and throwing fireworks at cops

",82
501,jlogancarey,1727711269,"Also found out Disney puts out these sweet books on each movie focusing on concept art, storyboards, awesome begins… ",117
502,JuliaAndTomsMom,635359790,watching Fantastic Beasts at Weston 8 Cinema ,45
515,foxangent8,2748487354,It’s fun watching these players play #PHILMLAND24 ,50
516,AmIOnTheAir,328860741,#SMILF Set for January Return at Showtime — Watch Season 2 Trailer  ,68
518,Adam_Penner,346718982,If you don't subscribe to this channel and you're a fan... You are missing out.  Can't wait for his fan film series… ,117
520,XUrbanMusicMag,1069155912,NASIR - The Film ,17
522,neherald,2899555050,Mott-Regent starts hoop season in December - The New England Extra ,67
528,Everyday_MBA,3067201166,"We loved speaking with Dr. Dileep Rao from Florida International University in this episode. His new book ""Nothing… ",116
532,HuberTennisRnch,449301492,"The crew watching some tennis!
Jeananne Curington ",50
534,hentailogic,255325854,"Was having a cold and a headache, but watching the Haunting of Hill House made my mind clear and sharp again. On ep… ",117
535,cdaviswx,259048083,Watching the trucks race for a championship at Homestead always reminds me of the Stars Series title I won there. I… ,117
536,DASOULDOUTSHOW,221179602,"🎅🎅🎅🎅🎅🎅🎅🎅🎅🎅🎅🎅

TOMMORROW :WORLD PREMIER of MY BROTHER  GREG CARTER'S NEW HIT FILM :""ONE CRAZY CHRISTMAS"" on SAT 11/1… ",117
545,MaggieMac18,50507237,So annoyed that Netflix is slowly rolling out the Christmas movies. ,68
549,fierah,15194244,Time for another Netflix Original Christmas movie about a handsome prince of a made-up country and the clumsy Ameri… ,117
550,alemdomeuceu,342624758,La netflix ,11
553,Shellymomma2,178925849,"YAY FOUR CHRISTMASES IS ON NETFLIX!!! Sparkling wine, candles lit, doin me nails..night made!! ",95
559,techtalkradio,7330692,"
We talked with Mitch Goldstone about Scanning Photos, Slides and transferring Film to Digit… ",94
564,stevebrodzy,21844678,"I'm watching Movin' on Up-date - Nic Dowd, Kevin Gravel &amp; Jonny Brodzinski on NCHC ",87
565,Classical_LPs,381598790,"Billy Corgan has unveiled a psychedelic short film, Pillbox, which features music from  ",88
567,Jazz_Records,377649839,"Billy Corgan shares psychedelic short film, Pillbox  #vinyl ",60
568,Beatles_Record,366529246,"Billy Corgan has unveiled a psychedelic short film, Pillbox, which features music from  ",88
569,justbangers14,234779339,The Chainsmokers Discuss Upcoming 'Paris'-Inspired Film  ,57
570,Madonna_Records,494092644,"Billy Corgan shares psychedelic short film, Pillbox  ",53
572,Stones_Record,492959362,"Billy Corgan has unveiled a psychedelic short film, Pillbox, which features music from  ",88
574,Press_ToPlay,388848387,"Billy Corgan shares psychedelic short film, Pillbox  ",53
575,being_zezo,3148303950,I just finished watching Broadchurch! #tvtime  ,47
576,Elvis_Records,498075532,"Billy Corgan has unveiled a psychedelic short film, Pillbox, which features music from  ",88
577,CuttingEdgeTrad,285107363,"My Little Eye (2 x DVD, 2001) Special Edition HORROR NEW SEALED PAL Region 2  ",78
579,PSB_Records_CDs,498087725,"Billy Corgan shares psychedelic short film, Pillbox  ",53
581,U2_records,498062586,"Billy Corgan has unveiled a psychedelic short film, Pillbox, which features music from  ",88
584,991VinylRecords,318498823,"Billy Corgan shares psychedelic short film, Pillbox  ",53
586,PressTooPlay,403409129,"Billy Corgan shares psychedelic short film, Pillbox  ",53
587,KaylaCMarie,733717304,"Spending my Friday night watching my boyfriend, my grandpa and my grandpas siblings play card games. My grandpa and… ",117
588,son_of_grace1,2880826378,#veryemotional — watching Boy Erased at Regal Cinemas Winter Park Village 20 &amp; RPX ,87
592,DASOULDOUTSHOW,221179602,"🎅🎅🎅🎅🎅🎅🎅🎅🎅🎅🎅🎅

TOMMORROW :WORLD PREMIER of MY BROTHER  GREG CARTER'S NEW HIT FILM :""ONE CRAZY CHRISTMAS"" on SAT 11/1… ",117
601,MRobertsG44,531887214,School Punishes Male Teacher For Refusing To Watch A Naked Girl ,64
604,KieOsha22,122211647,My mom is pure COMEDY!!😂😂 ,26
605,Pinball_5x5,28155951,Finally! — watching A Star is Born at Galaxy Theatres Atascadero ,65
608,SteveSandberg,48853430,Season finale of Locals Live is tonight at 6! We've got a good one tonight with Flow Resale! Watch live at… ,108
613,Spencaaa_M,120842879,"It me, watching Kansas HS football on a Friday night. ",54
614,rvinpandya,123551051,Netflix mulls ‘content code’ in India ,38
620,Marvel,15687962,"Watch a clip featuring M'Baku from all-new episode of ""Marvel's Avengers: Black Panther's Quest,"" airing this Sunda… ",117
628,Ltd_To_Two,492991594,"For those who love us, accepting our #chronicillness is really hard – And watching what it does to us, even harder… ",116
629,939MIA,67172663,"Netflix's Holiday Shows and Movies Full List

 ",47
630,BookSizzle,2711039001,"The ""light"" inspired hatred. The beautiful and perpetual darkness had been disturbed forever. And their calm had be… ",117
633,BryanCassiday,27523264,The stories are fiction.  The horror is real.  (Helter Skelter by Bryan Cassiday) - ,84
634,WTKR3,23517712,NOAA says watching for right whales during migrating season is more important than ever  ,89
642,08Carla_,124265662,Me watching “Dogs” on Netflix ,30
643,BlogBookMark,156765896,Aretha Franklin’s ‘Amazing Grace’ film finally in theaters ,59
646,kmillerheidke,25287549,Such a treat watching this GLORIOUS cast smash it last night for the opening of #mtctwelfthnight. The genius Simon… ,116
647,LetsKickASS_Or,2612716412,"The holidays can be tough on those who are socially isolated. Please reach out to someone who is alone this season,… ",117
648,Thebigbadben90,2907933725,This 10 minute short film celebrates its 6th anniversary. Giant God Warrior Appears In Tokyo. Watch this if you hav… ,117
650,KimFalconer,17148395,Explore the role of the Trickster in film and lit. My monthly post on the Supernatural Underground blog.… ,106
651,designmelo4,546226613,"This was one of my favorite Melo Project Runway Fashion Show Fundraisers,,, we had 85 young models that volunteered… ",117
654,lancellotwendel,80341748,"New podcast episode is up!
",27
655,DASOULDOUTSHOW,221179602,"🎅🎅🎅🎅🎅🎅🎅🎅🎅🎅🎅🎅

TOMMORROW :WORLD PREMIER of MY BROTHER  GREG CARTER'S NEW HIT FILM :""ONE CRAZY CHRISTMAS"" on SAT 11/1… ",117
660,CatharsysGaming,3391292535,"As shared in discord, been watching She-Ra and this scene hit. I am busting up!  #muchlove ",91
669,pup_odie,4827964931,In bed watching elf :D ,23
670,garbaumar,255065124,"Hasan al-Basri (Rahimahullah) said: 

1. My (rizq) richness cannot be taken by anyone so my heart is contended.

2.… ",117
672,Humanstein,15579464,Caught this The Life Aquatic With Steve Zissou reference in this science show that my daughter is watching on… ,111
