index,screen_name,user_id,tweet_text,length
1393,TrevDon,54387487,"What movie made you cry as a kid, and if watched again as an adult, would probably make you cry again.  This is min… ",117
1395,NewYorker,14677919,"From the mean and grasping shenanigans that pass for a plot in Yorgos Lanthimos's new film, ""The Favourite,"" there… ",116
1399,JimVaughanPMP,23991620,"Watching the game from 'The Blackhawk Room"" #authenticfan ",58
1406,FloWrestling,18174186,Jacob Warner loves watching Marinelli. ,39
1408,SoapySheep,3327480428,Me waiting for my copy of pkmn let's go to come in the mail watching everyone else playing it ,94
1411,OneMJoke,1541258886,Some people should not be allowed near children. Even possessed children. ,74
1412,nivelon5,2967861099,"Beautiful boys masturbations film gay Criminal mastermind Dustin
  
 www vide gay barebacket… ",94
1413,marybschneider,102716915,Me watching myself on TV ,25
1414,mkrabill,16780838,Date night! — watching Bohemian Rhapsody at AMC the Parks At Arlington 18 ,74
1419,perkinsphotos1,2698434986,I love the trees. I love to frame shots with the branches... but sometimes the sky is the best show... ,103
1420,craigfoster,50049696,Finally saw #AStarIsBorn. I thought the acting was beautiful as was the film as a whole. My beef was that I heard B… ,117
1421,FirstAdvocates,191277859,"Calum Marsh writes that the movie Cam is ""a superb, highly original tech-thriller.""  One of the creators, Isa Mazze… ",117
1427,GossipBucket,277600246,It's ‘The Hills' - But Musical! See Why Netflix's Hot New Reality Show ‘Westside' Has Twitter Obsessed!: There's a… ,116
1438,OrangeSlushie,24380124,"Me watching that tribal play out
#Survivor ",43
1440,mariejamora,14901072,"Historic Hollywood moment, guys! We have a PINAY Batgirl!!! And she's the daughter of Derek Basco, who played our D… ",117
1450,NYounker,420112221,"They're so cute when they're alive...
#Horror ",46
1455,jade_80,23812696,American Horror Story The Complete First Season DVD ,52
1460,sixxers,57154512,"If you ever have just a few tweets on your TL, or just this message below, turn off the ""show best tweets first"" op… ",117
1463,joferguson9,501521155,When I'm watching an old British film &amp; an actor says cor blimey... #gopies ,80
1465,JHScramble,200673046,Who's watching #LivePD ,23
1473,ATWHK,63934136,"I liked Croatia! Wish I could have spent more time there. When we explored the waterfront in Split, I felt like I w… ",117
1474,jeffquinde,27373955,My brother is going places! Love you big bro! Kick some ass and show them who the best chef in the world is ,108
1475,megsokay,55846083,I consider it a personal attack that there is not a new season of Great British Baking Show available every weekend… ,117
1477,LotsaSavage,2461528211,I got Sabrina! ,15
1478,starsppl1,4860194463,Netflix Sued Over Sabrina and Satanic Imagery ,46
1483,CatbirdRed,285568392,On this episode. We talk with New Virginia Tech Softball HC Pete D'Amour who talks about coming to Virginia Tech an… ,117
1487,gooshi2000,63720592,"(A Soldier And His Transgender Daughter Demonstrate True Love In Powerful Short Film)  

A young transgender girl a… ",117
1491,josadeek,4618397832,"From the mean and grasping shenanigans that pass for a plot in Yorgos Lanthimos's new film, ""The Favourite,"" there… ",116
1497,kamquat,417415108,im watching shera ,18
1501,tutski4,3514801055,"This is for my friend Charlie Leo,,,, watching some college wrestling brother ",78
1504,Network15TV,715921784,Some people should not be allowed near children. Even possessed children. ,74
1509,RKAthey,172975611,Better networking through film examples. ,41
1511,rafaeldrincon,153205191,"The best thing to hold onto in life is each other.
-- Audrey Hepburn. --
Nothing else matters, really. Nothing else… ",117
1512,theburbsman,74617138,"#NovemberFilmChallenge

Day 16

Movie with fast food. 
This is so easy...

Harold and Kumar Go To White Castle of c… ",117
1513,Adaxbi,292872410,me watching jelena stans cry for the past 5 years. ,51
1515,primalkey,33058015,Gold Standard: 'Roma' puts Netflix in the thick of the best picture Oscar race - Los Angeles Times ,99
1521,Hahaybuhey,1659543756,"Still Available!!

 *NETFLIX PREMIUM PH:
 -Shared Account 1device/1profile - 80 php
-Solo Account 4 device/ 4  prof… ",117
1522,AnicaPadilla,476766914,"A soldier says a stranger’s Christmas card got him through the Vietnam War. 
He just met the sender.
You won't regr… ",117
1523,KCET,33726864,"Chef Claudette Zepeda-Wilkins has opened her new restaurant, El Jardín, in San Diego with the intention of elevatin… ",117
1524,CBSDenver,16313592,"A soldier says a stranger’s Christmas card got him through the Vietnam War. 
He just met the sender.
You won't regr… ",117
1527,NoEscalators,49780957,Mom's watching. ,16
1528,JamieMoranUK,580928629,"The Castlevania Netflix Producer...

Is Working on a Devil May Cry Multiverse Series ",85
1533,Hahaybuhey,1659543756,"Still Available!!

 *NETFLIX PREMIUM PH:
 -Shared Account 1device/1profile - 80 php
-Solo Account 4 device/ 4  prof… ",117
1537,__cnxo,220110326,I just finished watching both seasons of Big Mouth on Netflix. My husband has been giving me looks as I watch this… ,116
1538,Hahaybuhey,1659543756,"Still Available!!

 *NETFLIX PREMIUM PH:
 -Shared Account 1device/1profile - 80 php
-Solo Account 4 device/ 4  prof… ",117
1539,jerrytyrone9,50581627,my friend Jesse watching John Wick for the first time: ,55
1541,NickPBetancourt,264522188,Watching my good friends Chico Castillo and Eduardo Fuentes of Gypsy Kings on stage!! ,86
1545,Hahaybuhey,1659543756,"Still Available!!

 *NETFLIX PREMIUM PH:
 -Shared Account 1device/1profile - 80 php
-Solo Account 4 device/ 4  prof… ",117
1558,DevagiSanmugam,514737322,I like creaming butter and sugar and watching it become almost doubled in mass and lightened to a yellowish-white c… ,117
1563,NFLMatchup,804669823,"🚨SET YOUR ALARM CLOCKS! (Or DVR) 🚨

NFL Matchup has the best X's &amp; O's content out there for you to talk some REAL… ",120
1571,ohmz,33893,Leon is watching the Jungle Book with rapt attention... ,56
1574,Ragzdandelion,44754229,"This would be so cool to see. Imagine all the Avengers,X-Men, SpiderMan, Venom ,Blade, the Netflix characters, all… ",116
1575,Laaaaaaren_,255746959,"It’s November 16th, I’m watching the grinch, decorating for Christmas, and drinking wine with the absolute love of… ",116
1577,cermetparrilla,2875411621,guess what i'm watching ,24
1578,hiddnen,76440770,Tfw when u are out being social and u just end up watching fork knife! ,71
1580,ConnorMovies,3391276402,Well #FantasticBeasts2 is one of the bigger disappointments of the year sadly. Really liked some things including D… ,117
1584,RedMakuzawa,715749667,"Mob Psycho 100 Season 2 new key-art; airs January 7th.
 ",56
1585,busch_will,4910088855,Watching my granddaughter in A Midsummer Night's Dream at my old High School ,77
1593,PravNJ,34003593,Watching The Smashing Pumpkins reunion concert (3 hours!) ,58
1598,WillyNillyMilly,2352687313,Hate to say it but the Vanessa Hudgens movie on Netflix is no bueno. ,69
1602,ElLiamano,176805762,When you show your 4 year old daughter Ghostbusters for the first time and she says “I Love this movie so much” at… ,116
1603,UclaFan74,174173148,Just watched Super-Fan Builds on Netflix Ep.4. They made a Joe Bruin beverage bear. Nice ,89
1607,Helen57014909,785117040,Great Win tonight.  I ❤️ watching you play. ,44
1612,ganster0403,305074961,Yes Me &amp; Baby! — watching Nobody's Fool at Movie Tavern ,60
1613,GariepyHomes,1056618786,The Big List of Christmas Movies on Netflix ,44
1614,lfedit,32457868,On a tear since watching “Julie &amp; Julia.” Butternut squash soup with shrimp and chocolate poke cake. ,105
1615,PoliceMag,78087055,[Feature] IACP 2016 Best of Show: This year's IACP show held in San Diego from Oct. 16 through Oct. 18 didn't reall… ,117
1618,OxfodderOxford,2161691960,RT Jee_vuh: Netflix's DOGS is a big mood ,41
1621,news_ninjas,2195109301,Watching “THE OMEN” With Your Child’s Pediatrician ,51
1624,NorAfroWatch,1584829771,#NorthAfrica Call For Entries: New York Forum of Amazigh Film Festival  ,72
1628,RobertZeglinski,2432235702,"I say it every time, and won't stop.
Each of Khari's film📽️ studies are treats filled with nuance and personality.… ",116
1633,katieversion2,21537361,Lazy night in the Smith household. Watching tv in bed. Kitty included. ,71
1637,PendragonFc,21347197,"The new M’s gear came in! Even with the season over I still love my M’s!
#seattlemariners ",90
1646,emc4478,3086145090,I think that The Incredibles films are family films rather than kids films. A kids film is a harmless distraction t… ,117
1649,Dualwieldomo,30573460,"
Best Friday show ever!",23
1652,djjonnyroxx,314392472,You’re all a sick bunch for watching this. ,43
1655,90sginny,3638642657,I can't stand watching cedric dying rn i- ,42
1657,MzCreole_Doll,253963403,Recovering from surgery but I’m still watching #MidnightTexas ,62
1661,thenoblestroman,378257151,Me bitterly watching the same 5 ppl on rotation constantly post about seeing bts up close at their 600th show or go… ,117
1663,thewhatnauts,4627021872,"We are live!! Record a new episode of The Captains Log!

 ",58
1665,evileyepictures,263036936,We are honored to have worked on this project. Proud to be part of this awesome collaboration. #AgeOfSail… ,107
1668,bradford_adkins,40529799,ATM: First day showing at Concord’s newest Veranda LUXE Cinema and IMAX! — watching Fantastic Beasts at Veranda LUX… ,117
1669,maddiedigsports,21162887,good evening. my name is maddie and tonight i will be watching Jupiter Ascending while drinking wine ,101
1670,GreenwoodYelhsa,2277866845,Started watching “She’ra” on Netflix earlier and I wanted to put my own spin on the character... It’s far from fini… ,117
1675,TrevDon,54387487,"What movie made you cry as a kid, and if watched again as an adult, would do it again.  This is mine.  One of the s… ",117
1680,radiostpete,1951862624,"Instead of cable, Netflix or Facebook tonight ... at 10 pm ET turn out the lights ... turn on RadioStPete and turn… ",116
1682,hh133hh,119942535,"Burgers, Butterbeer, Bumper-to-bumper traffic, and BEASTS!!!!!! 
🍔🍻🚗🦕 — watching Fantastic Beasts at Movie Tavern ",114
1685,kylesean08,2838481326,"Watching nba with my lolo edison GoOo 76ears

#NBAONABSCBN ",59
1690,csmonitor,14857525,The film depicts Van Gogh’s last prolific years. ,49
1691,hontoumi,2529172441,"[official_izone] 181114 — [👀] IZ*ONE (#아이즈원) - 1st Mini Album [COLOR*IZ] Jacket Making Film

🖇… ",96
1694,Knight_Rider17,421356724,Me watching these YouTube make up tutorials ,44
1696,saltinesfosuppa,67941144,"Me, watching Wreck It Ralph in theaters next week #ThisIsAnInvite ",66
1705,theycallmeStu,82284785,Watching this game with my bud. #UTAatPHI ,42
1721,CheckYourTown,41376201,"📅 THIS WEEKEND across Massachusetts ....
➠ Nutcracker Racing Thrill Show  
➠ Drag Extravagan… ",94
1722,FirstAdvocates,191277859,"In the new film Sauvage, director Camille Vidal-Naquet ""strives to portray the reality of life as a gay hustler in… ",116
1723,DroopySunflower,7771782,The End of Endings - The New York Times ,40
1731,SFDChilly,26248892,Pink laces! Trevor Childears skating off the ice after a 7-2 victory over the New Jersey Hitmen. Trevor scores the… ,116
1733,FatimahAnuar13,1407524690,"I love it when I'm watching movies and everyone just can't stop asking me who's this character, what happen next, w… ",117
1734,IntoxOnLife,604200494,"Kids are always watching. Every move we make. Every word we say. Kids see and hear it all. 

Here is a story of one… ",117
1738,tutski4,3514801055,"This is for my friend Charlie Leo, me and Addie watching some college wrestling brother. 🤼‍♂️ ",94
1741,chicagoinformer,297965399,Column: How Donald Trump made political comedy grate again  ,60
1743,REMAXDean,33520845,watching Fantastic Beasts at GQT Quality 10 GDX ,48
1744,DrsCoffeeCup,1265174251,This came from Reddit apparently. Sums up about 50% of #DoctorWho’s online fandom currently from what I’ve seen. If… ,117
1751,angelaanimates,343018527,"This is a beautiful short that I had the opportunity of seeing thanks to 
Benoit from The Animation Showcase. You g… ",117
1755,thebigbogz,1270202216,Fans Want Deadpool To Take Over Stan Lee's Marvel Cameos ,57
1758,b29953,599437060,"I want to win!

",16
1761,aevanko,27212934,A 2 year old Yuna showing how to use the 3 hit combo of the Lance (that is exactly what she is doing after watching… ,117
1767,DEADLINE,586032653,‘The Magicians’ Unveils SyFy Season 4 Trailer And The New Quest  ,65
1768,ChiPublicHealth,159822837,"CDPH LGBTQ Liason, Antonio King at the 2018 Black Alphabet Film Festival. 🏳️‍🌈 #PartyBoi ",89
1771,RachMae_CMYK,74071578,"Day 16: 20 films that had an impact on you, for the next 20 days. 

Only post a pic. No film title or comment.… ",112
1781,austila9,27665634,Locally Brewed comedy show. — attending Resurgens Comedy Fest at Highland Inn &amp; Ballroom Lounge ,100
1782,1EntreProNegro,151448846,Melo at the crib watching all these games tonight like. 🤬🤬 ,59
1788,drhemant99,25523214,"After watching Thugs of Hindustan 🤣😂🤣
Entertainment is essential stress buster, but bad entertainment is a stress! ",115
1789,SergiusAugustus,1483583714,Uncle Jair is watching you! ,28
1792,dawnlysimple,61292007,i don't like this quirk. my Sim wasn't even being vain; it was triggered when she was making funny faces in the mir… ,117
1802,cacheupdate,33207551,International Film Night ,25
1808,IMHIGHBBYIDC,2956139003,"This is my kinda show. Gore, horror and pure chaos. Wow. ",57
1809,SsanimeMannyXmn,24016642,📹 Castlevania 2 on netflix is official!And New drama anime series starts J… Link to both of the... ,99
1811,maryhasthekeys,2682750540,"Frank McCourt's novel “Angela’s Christmas"" set for Netflix ",59
1817,BookTeasers,2897593697,"The ""light"" inspired hatred. The beautiful and perpetual darkness had been disturbed forever. And their calm had be… ",117
1823,eyelove808,32926244,"New Short Film Shows 'Why It's Cool To Be Vegan'
",49
1825,joaozinhomarcos,3090001167,I earned the American Horror Story Serial Emotioner badge on TV Time! ,70
1826,hburton375,3300020889,"Hmm, there's a new episode called ""Cosmic Bupkis"". I can't wait. ",65
1827,DandyBoyBrian,746615605,"Medyo, nakakatakot na'to ah. I mean, the show is problematic at best but hindi tamang a government putting pressure… ",117
1829,caramind93,2882782487,#SaturdayNightScifi selected severals fun and thoughtful Scifi shorts film available on youtube and vimeo (Selected… ,117
1830,zgradewarehouse,16873331,Halloween Horrorthon 2018 // Day 26 // Unidentified film reveal // You guys probably thought I forgot about the las… ,117
1833,iangertz,37421236,Top 25 Music Schools for Composing for Film and TV  ,52
1836,bradford_adkins,40529799,ATM: First day showing at Concord’s newest Veranda LUXE Cinema and IMAX! — watching Fantastic Beasts at Veranda LUX… ,117
1837,sewell_keith,2379729613,"Willow Canyon watching Centennial and Higley, Higley scores after a three-and-out Centennial takes it back on the k… ",117
1838,jade_80,23812696,American Horror Story Freak Show Season 4 DVD ,46
1839,kthlnferguson,73646694,"Frank McCourt's novel “Angela’s Christmas"" set for Netflix ",59
1842,DJH5Report,318176790,The Nephew &amp; I are All the over #ThePlex 2 nite watching our favorite Sport (Basketball)....  Left DVille Game to C… ,121
1850,northjersey,34677788,Aretha Franklin's 'Amazing Grace' film hits theaters  ,54
1851,NZStuffEnt,15776408,"Dogs, puppies and more dogs everywhere on your screen in new Netflix doc  ",74
1856,douglasgiz,29543855,I just finished watching Bates Motel! #tvtime  ,47
1858,NitrateDiva,722972322,"Craving Christmas in #Noirvember, so I'm currently watching THE LADY IN THE LAKE. A bit of a mess with the constant… ",117
1859,phoenix_wrights,402444465,Watching a certain movie for the first time ,44
1860,kristinlegacy,1682547728,Watching a Christmas movie. #selfie ,36
1861,BowersMuseum,33950355,"Academy 🎥 Award-winning “Ladri di Biciclette - Bicycle Thieves,” 🔥 will screen this Sunday, Nov 18 at 2pm during CI… ",117
1867,OKCStormWatcher,26079308,I'm watching Live PD Presents: PD Cam - S01E12 - #112 ,54
1871,Blinking_Pixels,24350513," No Christmas Episode for Doctor Who. Instead, there will be a New Year's Day Episode.",86
1872,mnrdespinoza,346418541,Bonding with my son watching NBA #NBASABADOS ,45
1874,patrickhoelck,17435830,"Jerry Ohlinger, Colorful Dealer in Film Memorabilia, Dies at 75 ",64
1879,Xrhstos__Mp,3086834747,Armin Van Buuren feat. Nadia Ali - Who Is Watching (Original Mix) ,66
1880,CryptidEnby,3252420284,What was supposed to be a film of them eating out of a bowl for the 1st time turned into a vid about markus being s… ,117
1883,SGarberGirl,1009392919,"♠️*insert trumpet noise*♠️ It’s the UK paperback cover for Legendary!
.
I’ve been watching this graphic for days an… ",117
1884,GuyBenson3,891678516,What's Wrong with Donald Trump | Chelsea | Netflix ,51
1885,RichStoffers1,2174748109,Interesting (weird) nite 4 me! I'm watching - live streaming St. Benn' s vs. St. Olaf women's ice hockey game! Then… ,117
1889,zirigozacom,130848291,Billie Lourd Says American Horror Story Saved Her Life After Mom Carrie Fisher Died 👌 by  📽️… ,94
1890,TheDeadFellow,1601753694,"Don't say hit to your mother for me, Wahlberg and Berg

",56
1894,Jeremy_Capo,29844525,"My favorite memory will be watching this group compete! 

I was told ""I have a scholarship to my dream school, and… ",116
1906,KatStilesAuthor,1711104398,"Banished Heroes Return In ""Black Hammer"" #horror ",49
1909,SantaAnaArts,2399004121,"BowersMuseum: Academy 🎥 Award-winning “Ladri di Biciclette - Bicycle Thieves,” 🔥 will screen this Sunday, Nov 18 at… ",117
1927,TimesNow,240649814,Chinese Ambassador to India Luo Zhaohui has said three things are most fashionable among the Chinese youth in urban… ,117
1931,FortuneMagazine,25053299,Sears just secured a new loan to stay open for the holiday shopping season ,75
1934,echinacea_03,82847523,AaAaAaAa gonna be watching this all day (with Pocky) ,53
1937,mllshow,3441419535,‘Insecure’ Star Amanda Seales’ First Comedy Special Is Coming To HBO - Essence ,79
1940,Khalivius,2216531967,"So I’m watching these Snapchat discovery stories, Twitter find who this is because literally me 😂 ",98
1941,FlirtTiffany,3006550637,Someone just made me a favorite on #NiteFlirt. Call me at  to see why.,70
1943,pophistory,226278481,Gritty ‘Widows’ brings the dead heist film genre back to life: ,63
1946,aaron_harder,719363630,When you think mudmasks will be fun but turns out you just became the villain in a poorly made horror movie about f… ,117
1954,AmiyBizness,36384128,#netflix&amp;jill ,18
1955,breemilloy,766812050,"Yes! I hope this happens. 👻💚

",30
1964,SDArtsTix,161010694,"Perhaps the most charming musical ever written, Scripps Ranch Theatre's ""She Loves Me"" is a warm romantic comedy wi… ",117
1967,SCLancerNation,1514145978,"SCLancerNation - With his Second TD tonight, Bijan R has 33 this season a new single season Salpointe record passin… ",117
1968,shawnnamariie,398360961,Watching greys anatomy with Mallory is basically her every 15 min saying “wait this is a good part” ,100
1971,RougeParry,5902162,That’s a lot of pressure on your facial expressions this one might be a couple of years to soon ,96
1975,fusioneletronix,1444346588,"DT Daily: Google Pixel Night Sight, Surface Studio 2, and Netflix at half price: ",81
1977,deena216,34730917,Just watched the first episode of #DogsOnNetflix:  A heartwarming story about how a service… ,93
1978,nekit1837,1358802656,"Teen shaved twink hardcore mobile gay porn vids and old man gay porn
  
 gay son with dady W… ",94
1979,fuckbiebz_,512700181,I've just watched episode S08E10 of American Horror ...! #tvtime  ,66
1982,lifewithmads,3023659453,"me trying to decide between the new ‘this is us’ episode, catching up on ‘a million little things’ or finally finis… ",117
1990,culturageekpr,4806027889,I'm fine with this! ,20
1992,decider,2479845637,Netflix's #Dogs has one frustrating problem: it’s more about the people who love dogs than it is about dogs.… ,110
1993,martingero,22646558,"Thanks for watching. I can’t wait for you to see the next episode!

#Blindspot ",79
1994,Kazsoda,153534195,"Today, after a lecture at the Concordia University, I introduced “Inland Sea” , the last film to present here, to t… ",117
1996,TheLaughFactory,29838500,There is so much awesome ALL-STAR talent on this line-up that it really should be called an ALL-GALAXY Comedy Show.… ,117
2000,GwenPriceHomes,269414478,"Watching the Kominsky Method on Netflix starring Michael Douglas and Alan Arkin.  Super funny, well written....… ",113
